{
  "schema": "rusty.fleet.quest_awake_operation.v1",
  "operation_id": "awake-operation-1",
  "action_id": "quest.awake-control",
  "lifecycle": "applied",
  "preview": {
    "schema": "rusty.fleet.quest_awake_preview.v1",
    "preview_id": "awake-preview-1",
    "operation_id": "awake-operation-1",
    "action_id": "quest.awake-control",
    "action": "stop_watchdogs",
    "created_at_ms": 1000,
    "expires_at_ms": 61000,
    "fleet_revision": 7,
    "duration_ms": 28800000,
    "watchdog_interval_ms": 5000,
    "watchdog_generation": "awake-generation-1",
    "owner": {
      "owner_repo_id": "questionable-file-manager",
      "capability_id": "questionable-file-manager.quest-awake-provider",
      "provider_contract": "questionable.file_manager.fleet_awake_provider.v1",
      "receipt_schema": "questionable.file_manager.quest_awake_receipt.v1",
      "transport": "pinned_local_subprocess",
      "application_proof": "fresh_effective_power_and_watchdog_readback"
    },
    "targets": [
      {
        "device_id": "device.quest.1",
        "identity_revision": 7,
        "capability_id": "questionable-file-manager.quest-awake-provider",
        "capability_evidence_revision": 11,
        "capability_owner": "questionable-file-manager",
        "support": "supported",
        "enablement": "enabled",
        "authorization": "authorized",
        "reachability": "reachable",
        "freshness": "current",
        "observed_at_ms": 900,
        "fresh_until_ms": 30000,
        "evaluated_at_ms": 1000,
        "eligible": true,
        "reason_code": "ready",
        "message": "Pinned Quest awake provider is current and ready."
      }
    ]
  },
  "confirmed_at_ms": 1100,
  "targets": [
    {
      "device_id": "device.quest.1",
      "identity_revision": 7,
      "preflight": {
        "device_id": "device.quest.1",
        "identity_revision": 7,
        "capability_id": "questionable-file-manager.quest-awake-provider",
        "capability_evidence_revision": 11,
        "capability_owner": "questionable-file-manager",
        "support": "supported",
        "enablement": "enabled",
        "authorization": "authorized",
        "reachability": "reachable",
        "freshness": "current",
        "observed_at_ms": 900,
        "fresh_until_ms": 30000,
        "evaluated_at_ms": 1000,
        "eligible": true,
        "reason_code": "ready",
        "message": "Pinned Quest awake provider is current and ready."
      },
      "lifecycle": "applied",
      "invocation": {
        "schema": "rusty.fleet.quest_awake_owner_invocation.v1",
        "request_id": "awake-request-1",
        "operation_id": "awake-operation-1",
        "preview_id": "awake-preview-1",
        "device_id": "device.quest.1",
        "identity_revision": 7,
        "action": "stop_watchdogs",
        "duration_ms": 28800000,
        "watchdog_interval_ms": 5000,
        "watchdog_generation": "awake-generation-1",
        "issued_at_ms": 1200,
        "expires_at_ms": 61000
      },
      "receipt": {
        "schema": "questionable.file_manager.quest_awake_receipt.v1",
        "request_id": "awake-request-1",
        "operation_id": "awake-operation-1",
        "preview_id": "awake-preview-1",
        "device_id": "device.quest.1",
        "identity_revision": 7,
        "action": "stop_watchdogs",
        "watchdog_generation": "awake-generation-1",
        "requested_duration_ms": 28800000,
        "requested_watchdog_interval_ms": 5000,
        "stay_on_effective": true,
        "proximity_hold_effective": true,
        "wake_effective": true,
        "windows_watchdog_effective": false,
        "device_watchdog_effective": false,
        "settings_restored": false,
        "effective": true,
        "settings_left_unchanged": true,
        "outcome": "watchdogs_stopped_settings_unchanged",
        "repair_count": 0,
        "power": {
          "wakefulness": "Awake",
          "display_state": "ON",
          "stay_on": true,
          "auto_sleep_disabled": true,
          "proximity_state": "CLOSE",
          "proximity_hold_duration_ms": 28800000,
          "proximity_hold_remaining_ms": 28799000,
          "captured_at_ms": 1400
        },
        "device_watchdog": {
          "reported_active": false,
          "fresh": false,
          "generation": "awake-generation-1",
          "boot_id_sha256": "aaaaaaaaaaaaaaaaaaaaaaaaaaaaaaaaaaaaaaaaaaaaaaaaaaaaaaaaaaaaaaaa",
          "interval_ms": 5000,
          "last_poll_ms": 1300,
          "proximity_repair_count": 0,
          "stay_on_repair_count": 0,
          "wake_repair_count": 0,
          "last_action": "stopped",
          "last_error": ""
        },
        "evidence_sha256": "bbbbbbbbbbbbbbbbbbbbbbbbbbbbbbbbbbbbbbbbbbbbbbbbbbbbbbbbbbbbbbbb",
        "observed_at_ms": 1400
      },
      "failure_code": null,
      "updated_at_ms": 1400
    }
  ],
  "updated_at_ms": 1400
}
